[
  {
    "id": 1,
    "kind": "neuf",
    "transaction": "vente",
    "title": "The Pantheon Residence – Rte de la Marsa",
    "type": "Appartement & Duplex",
    "price": 198000,
    "currency": "TND",
    "surface": 65,
    "rooms": 2,
    "pieces": 1,
    "bathrooms": 1,
    "location": "Route de la Marsa, Tunis",
    "zone": "La Marsa",
    "agence": "Bullaregia Immobilière",
    "badge": [
      "new",
      "livraison"
    ],
    "img": "https://bullaregia-immobiliere.com/wp-content/uploads/2024/03/exterieur-7.jpg",
    "logo": "https://bullaregia-immobiliere.com/wp-content/uploads/2023/04/logo-pantheon-light.png",
    "photos": 9,
    "lat": 36.8968,
    "lng": 10.3033,
    "delivery": "Livraison imminente",
    "tf": null,
    "date": "2j",
    "status": "active"
  },
  {
    "id": 2,
    "kind": "agence",
    "transaction": "vente",
    "title": "Villa de luxe avec piscine",
    "type": "Villa",
    "price": 890000,
    "currency": "TND",
    "surface": 320,
    "rooms": 7,
    "pieces": 6,
    "bathrooms": 4,
    "location": "Sidi Bou Saïd, Tunis",
    "zone": "Sidi Bou Saïd",
    "agence": "Prestige Immobilier",
    "badge": [
      "exclusive"
    ],
    "img": "https://images.unsplash.com/photo-1613490493576-7fde63acd811?w=400&q=80",
    "logo": null,
    "photos": 24,
    "lat": 36.8712,
    "lng": 10.3416,
    "delivery": "Livré",
    "tf": null,
    "date": "5j",
    "status": "active"
  },
  {
    "id": 3,
    "kind": "agence",
    "transaction": "location",
    "title": "Appartement S+2 vue mer panoramique",
    "type": "Appartement",
    "price": 1800,
    "currency": "TND",
    "surface": 85,
    "rooms": 3,
    "pieces": 2,
    "bathrooms": 1,
    "location": "Carthage, Tunis",
    "zone": "Carthage",
    "agence": "Prestige Immobilier",
    "badge": [
      "promo"
    ],
    "img": "https://images.unsplash.com/photo-1560448204-e02f11c3d0e2?w=400&q=80",
    "logo": null,
    "photos": 9,
    "lat": 36.8527,
    "lng": 10.3279,
    "delivery": "Disponible",
    "tf": null,
    "date": "1j",
    "status": "active"
  },
  {
    "id": 4,
    "kind": "neuf",
    "transaction": "vente",
    "title": "Les Jardins du Lac – Odéon",
    "type": "Duplex",
    "price": 420000,
    "currency": "TND",
    "surface": 190,
    "rooms": 5,
    "pieces": 4,
    "bathrooms": 3,
    "location": "Les Berges du Lac II, Tunis",
    "zone": "Lac 2",
    "agence": "Odéon Immobilière",
    "badge": [
      "new",
      "livraison"
    ],
    "img": "https://images.unsplash.com/photo-1580587771525-78b9dba3b914?w=400&q=80",
    "logo": null,
    "photos": 18,
    "lat": 36.837,
    "lng": 10.2364,
    "delivery": "Livraison imminente",
    "tf": null,
    "date": "3j",
    "status": "active"
  },
  {
    "id": 5,
    "kind": "agence",
    "transaction": "location",
    "title": "Studio meublé centre Tunis",
    "type": "Studio",
    "price": 750,
    "currency": "TND",
    "surface": 38,
    "rooms": 1,
    "pieces": 1,
    "bathrooms": 1,
    "location": "Centre Ville, Tunis",
    "zone": "Centre Ville",
    "agence": "Alpha Immo",
    "badge": [],
    "img": "https://images.unsplash.com/photo-1502672260266-1c1ef2d93688?w=400&q=80",
    "logo": null,
    "photos": 6,
    "lat": 36.8065,
    "lng": 10.1815,
    "delivery": "Disponible",
    "tf": null,
    "date": "2s",
    "status": "active"
  },
  {
    "id": 6,
    "kind": "neuf",
    "transaction": "vente",
    "title": "Résidence El Madina – Ennasr 2",
    "type": "Penthouse",
    "price": 650000,
    "currency": "TND",
    "surface": 250,
    "rooms": 5,
    "pieces": 4,
    "bathrooms": 3,
    "location": "Ennasr 2, Ariana",
    "zone": "Ennasr",
    "agence": "SPI El Madina",
    "badge": [
      "exclusive"
    ],
    "img": "https://images.unsplash.com/photo-1512917774080-9991f1c4c750?w=400&q=80",
    "logo": null,
    "photos": 20,
    "lat": 36.87,
    "lng": 10.19,
    "delivery": "T1 2026",
    "tf": null,
    "date": "1s",
    "status": "active"
  },
  {
    "id": 7,
    "kind": "neuf",
    "transaction": "vente",
    "title": "Galaxy Résidence – El Menzah",
    "type": "Appartement",
    "price": 240000,
    "currency": "TND",
    "surface": 102,
    "rooms": 4,
    "pieces": 3,
    "bathrooms": 2,
    "location": "El Menzah, Ariana",
    "zone": "El Menzah",
    "agence": "Galaxy Groupe",
    "badge": [
      "new"
    ],
    "img": "https://images.unsplash.com/photo-1570129477492-45c003edd2be?w=400&q=80",
    "logo": null,
    "photos": 11,
    "lat": 36.845,
    "lng": 10.165,
    "delivery": "T3 2025",
    "tf": null,
    "date": "4j",
    "status": "active"
  },
  {
    "id": 8,
    "kind": "agence",
    "transaction": "vente",
    "title": "Villa mitoyenne S+3 avec jardin",
    "type": "Villa",
    "price": 375000,
    "currency": "TND",
    "surface": 160,
    "rooms": 5,
    "pieces": 3,
    "bathrooms": 2,
    "location": "La Soukra, Ariana",
    "zone": "La Soukra",
    "agence": "Prestige Immobilier",
    "badge": [
      "promo"
    ],
    "img": "https://images.unsplash.com/photo-1564013799919-ab600027ffc6?w=400&q=80",
    "logo": null,
    "photos": 15,
    "lat": 36.892,
    "lng": 10.17,
    "delivery": "Livré",
    "tf": null,
    "date": "3s",
    "status": "active"
  },
  {
    "id": 9,
    "kind": "agence",
    "transaction": "vente",
    "title": "Terrain constructible TF – Zone résidentielle",
    "type": "Terrain",
    "price": 185000,
    "currency": "TND",
    "surface": 450,
    "rooms": 0,
    "pieces": 0,
    "bathrooms": 0,
    "location": "Ain Zaghouan, Tunis",
    "zone": "Lac 1",
    "agence": "Foncier Pro",
    "badge": [],
    "img": "https://images.unsplash.com/photo-1500382017468-9049fed747ef?w=400&q=80",
    "logo": null,
    "photos": 6,
    "lat": 36.86,
    "lng": 10.21,
    "delivery": "Disponible",
    "tf": true,
    "date": "6j",
    "status": "active"
  },
  {
    "id": 10,
    "kind": "agence",
    "transaction": "vente",
    "title": "Terrain agricole avec titre foncier",
    "type": "Terrain",
    "price": 98000,
    "currency": "TND",
    "surface": 2000,
    "rooms": 0,
    "pieces": 0,
    "bathrooms": 0,
    "location": "Mornag, Ben Arous",
    "zone": "Hammamet",
    "agence": "Terra Immo",
    "badge": [],
    "img": "https://images.unsplash.com/photo-1464822759023-fed622ff2c3b?w=400&q=80",
    "logo": null,
    "photos": 4,
    "lat": 36.72,
    "lng": 10.28,
    "delivery": "Disponible",
    "tf": true,
    "date": "1m",
    "status": "active"
  },
  {
    "id": 11,
    "kind": "agence",
    "transaction": "vente",
    "title": "Bureau open space – Les Berges du Lac II",
    "type": "Bureau",
    "price": 320000,
    "currency": "TND",
    "surface": 145,
    "rooms": 3,
    "pieces": 0,
    "bathrooms": 2,
    "location": "Les Berges du Lac II, Tunis",
    "zone": "Lac 2",
    "agence": "LakePark Immo",
    "badge": [
      "new"
    ],
    "img": "https://images.unsplash.com/photo-1497366216548-37526070297c?w=400&q=80",
    "logo": null,
    "photos": 9,
    "lat": 36.838,
    "lng": 10.235,
    "delivery": "Livré",
    "tf": null,
    "date": "1j",
    "status": "active"
  },
  {
    "id": 12,
    "kind": "agence",
    "transaction": "location",
    "title": "Bureau aménagé – Centre d'affaires Ennasr",
    "type": "Bureau",
    "price": 1800,
    "currency": "TND",
    "surface": 80,
    "rooms": 2,
    "pieces": 0,
    "bathrooms": 1,
    "location": "Ennasr 2, Ariana",
    "zone": "Ennasr",
    "agence": "BizCenter TN",
    "badge": [],
    "img": "https://images.unsplash.com/photo-1604328698692-f76ea9498e76?w=400&q=80",
    "logo": null,
    "photos": 7,
    "lat": 36.885,
    "lng": 10.192,
    "delivery": "Disponible",
    "tf": null,
    "date": "5j",
    "status": "active"
  },
  {
    "id": 13,
    "kind": "agence",
    "transaction": "vente",
    "title": "Villa S+4 jardin et piscine – Résidence Corniche",
    "type": "Villa",
    "price": 1150000,
    "currency": "TND",
    "surface": 380,
    "rooms": 5,
    "pieces": 4,
    "bathrooms": 4,
    "location": "La Marsa, Tunis",
    "zone": "La Marsa",
    "agence": "Prestige Immobilier",
    "badge": [
      "exclusive"
    ],
    "img": "https://images.unsplash.com/photo-1613490493576-7fde63acd811?w=400&q=80",
    "logo": null,
    "photos": 28,
    "lat": 36.878,
    "lng": 10.322,
    "delivery": "Livré",
    "tf": null,
    "date": "2j",
    "status": "active"
  },
  {
    "id": 14,
    "kind": "agence",
    "transaction": "vente",
    "title": "Appartement S+3 vue mer – Résidence Les Pins",
    "type": "Appartement",
    "price": 395000,
    "currency": "TND",
    "surface": 128,
    "rooms": 4,
    "pieces": 3,
    "bathrooms": 2,
    "location": "La Marsa, Tunis",
    "zone": "La Marsa",
    "agence": "Étoile Immobilier",
    "badge": [
      "new"
    ],
    "img": "https://images.unsplash.com/photo-1545324418-cc1a3fa10c00?w=400&q=80",
    "logo": null,
    "photos": 14,
    "lat": 36.876,
    "lng": 10.325,
    "delivery": "Livré",
    "tf": null,
    "date": "1j",
    "status": "active"
  },
  {
    "id": 15,
    "kind": "agence",
    "transaction": "location",
    "title": "Duplex S+3 meublé – Résidence La Méditerranée",
    "type": "Duplex",
    "price": 3500,
    "currency": "TND",
    "surface": 165,
    "rooms": 4,
    "pieces": 3,
    "bathrooms": 3,
    "location": "La Marsa, Tunis",
    "zone": "La Marsa",
    "agence": "Prestige Immobilier",
    "badge": [],
    "img": "https://images.unsplash.com/photo-1560448204-e02f11c3d0e2?w=400&q=80",
    "logo": null,
    "photos": 18,
    "lat": 36.88,
    "lng": 10.32,
    "delivery": "Disponible",
    "tf": null,
    "date": "3j",
    "status": "active"
  },
  {
    "id": 16,
    "kind": "agence",
    "transaction": "vente",
    "title": "Terrain constructible TF – Zone résidentielle",
    "type": "Terrain",
    "price": 275000,
    "currency": "TND",
    "surface": 620,
    "rooms": 0,
    "pieces": 0,
    "bathrooms": 0,
    "location": "La Marsa, Tunis",